,paper1_id,paper2_id,title1,title2,abstract1,abstract2
293,195346197,492537,Convolutional Neural Networks and Data Augmentation for Spectral-Spatial Classification of Hyperspectral Images,Parallel protein folding with STAPL,"Spectral-spatial classification of remotely sensed hyperspectral images has been the subject of many studies in recent years. Current methods achieve excellent performance on benchmark hyperspectral image labeling tasks when a sufficient number of labeled pixels is available. However, in the presence of only very few labeled pixels, such classification becomes a challenging problem.",The protein folding problem is to study how 
294,16483732,197431440,An Unsupervised Ranking Model for Noun-Noun Compositionality,Edge computing server placement with capacitated location allocation,"We propose an unsupervised system that learns continuous degrees of lexicality for noun-noun compounds, beating a strong baseline on several tasks. We demonstrate that the distributional representations of compounds and their parts can be used to learn a finegrained representation of semantic contribution. Finally, we argue such a representation captures compositionality better than the current status-quo which treats compositionality as a binary classification problem.","Edge computing in the Internet of Things brings applications and content closer to the users by introducing an additional computational layer at the network infrastructure, between cloud and the resource-constrained data producing devices and user equipment. This way, the opportunistic nature of the operational environment is addressed by introducing computational power in location with low latency and high bandwidth."
295,35469177,13631861,"Utility-Based Joint Routing, Network Coding, and Power Control for Wireless Ad Hoc Networks",Deep Convolutional Neural Network Design Patterns,"Energy saving and high delivery reliability are two essential metrics in wireless ad hoc networks. In this paper, we propose a joint power control and network coding (PCNC) scheme which regulates the transmission power to reduce the overall energy usage and uses network coding to improve reliability by reducing the number of packet retransmissions. To argue for PCNC scheme, we investigate both unicast and multicast routing scenarios. To evaluate routing optimality, we adopt expected utility as a metric, which integrates energy cost, reliability, and benefit value. Based on the expected utility, we explore the optimality in both unicast and multicast routing. For unicast routing, we propose an optimal algorithm. We show the NP-hardness of multicast routing problem, and also design a heuristic solution. Results from simulations demonstrate that PCNC improves the performance in terms of expected utility compared with existing techniques.","Recent research in the deep learning field has produced a plethora of new architectures. At the same time, a growing number of groups are applying deep learning to new applications. Some of these groups are likely to be composed of inexperienced deep learning practitioners who are baffled by the dizzying array of architecture choices and therefore opt to use an older architecture (i.e., Alexnet). Here we attempt to bridge this gap by mining the collective knowledge contained in recent deep learning research to discover underlying principles for designing neural network architectures. In addition, we describe several architectural innovations, including Fractal of FractalNet network, Stagewise Boosting Networks, and Taylor Series Networks (our Caffe code and prototxt files is available at https://github.com/iPhysicist/CNNDesignPatterns). We hope others are inspired to build on our preliminary work."
296,16931160,34326067,SkySuite: A Framework of Skyline-Join Operators for Static and Stream Environments,Supporting Decentralized SPARQL Queries in an Ad-Hoc Semantic Web Data Sharing System,"Efficient processing of skyline queries has been an area of growing interest over both static and stream environments. Most existing static and streaming techniques assume that the skyline query is applied to a single data source. Unfortunately, this is not true in many applications in which, due to the complexity of the schema, the skyline query may involve attributes belonging to multiple data sources. Recently, in the context of static environments, various hybrid skyline-join algorithms have been proposed. However, these algorithms suffer from several drawbacks: they often need to scan the data sources exhaustively in order to obtain the set of skyline-join results; moreover, the pruning techniques employed to eliminate the tuples are largely based on expensive pairwise tuple-to-tuple comparisons. On the other hand, most existing streaming methods focus on single stream skyline analysis, thus rendering these techniques unsuitable for applications that require a real-time ""join"" operation to be carried out before the skyline query can be answered. Based on these observations, we introduce and propose to demonstrate SkySuite: a framework of skyline-join operators that can be leveraged to efficiently process skyline-join queries over both static and stream environments. Among others, SkySuite includes (1) a novel Skyline-Sensitive Join (SSJ) operator that effectively processes skyline-join queries in static environments, and (2) a Layered Skyline-window-Join (LSJ) operator that incrementally maintains skyline-join results over stream environments.","Sharing the Semantic Web data encoded in Resource Description Framework (RDF) triples from proprietary datasets scattered around the Internet, calls for efficient support from distributed computing technologies. The highly dynamic ad-hoc settings that would be pervasive for Semantic Web data sharing among personal users in the future, however, pose even more demanding challenges for the enabling technologies. We extend previous work on a hybrid peer-to-peer (P2P) architecture for an ad-hoc Semantic Web data sharing system which better models the data sharing scenario by allowing data to be maintained by its own providers and exhibits satisfactory scalability owing to the adoption of a two-level distributed index and hashing techniques. Additionally, we propose efficient, scalable decentralized processing of SPARQL Protocol and RDF Query Language (SPARQL) queries in such a context and explore optimization techniques that build upon distributed query processing for database systems and relational algebra optimization. The effectiveness and efficiency of the SPARQL query processing mechanism we proposed for a decentralized settings were verified through a series of experiments. We anticipate that our work will become an indispensable, complementary approach to making the Semantic Web a reality by delivering efficient data sharing and reusing in an ad-hoc environment."
297,4358084,214802900,Robust Sensor-Orientation-Independent Feature Selection for Animal Activity Recognition on Collar Tags,Reconfigurable Voxels: A New Representation for LiDAR-Based Point Clouds,"Fundamental challenges faced by real-time animal activity recognition include variation in motion data due to changing sensor orientations, numerous features, and energy and processing constraints of animal tags. This paper aims at finding small optimal feature sets that are lightweight and robust to the sensor's orientation. Our approach comprises four main steps. First, 3D feature vectors are selected since they are theoretically independent of orientation. Second, the least interesting features are suppressed to speed up computation and increase robustness against overfitting. Third, the features are further selected through an embedded method, which selects features through simultaneous feature selection and classification. Finally, feature sets are optimized through 10-fold cross-validation. We collected real-world data through multiple sensors around the neck of five goats. The results show that activities can be accurately recognized using only accelerometer data and a few lightweight features. Additionally, we show that the performance is robust to sensor orientation and position. A simple Naive Bayes classifier using only a single feature achieved an accuracy of 94 % with our empirical dataset. Moreover, our optimal feature set yielded an average of 94 % accuracy when applied with six other classifiers. This work supports embedded, real-time, energy-efficient, and robust activity recognition for animals.","LiDAR is an important method for autonomous driving systems to sense the environment. The point clouds obtained by LiDAR typically exhibit sparse and irregular distribution, thus posing great challenges to the detection of 3D objects, especially those that are small and distant. To tackle this difficulty, we propose Reconfigurable Voxels, a new approach to constructing representations from 3D point clouds. Specifically, we devise a biased random walk scheme, which adaptively covers each neighborhood with a fixed number of voxels based on the local spatial distribution and produces a representation by integrating the points in the chosen neighbors. We found empirically that this approach effectively improves the stability of voxel features, especially for sparse regions. Experimental results on multiple benchmarks, including nuScenes, Lyft, and KITTI, show that this new representation can remarkably improve the detection performance for small and distant objects, without incurring noticeable overhead costs."
298,11338841,801539,Modular anomaly detection for smartphone ad hoc communication,Deep Neural Networks with Massive Learned Knowledge,"Abstract. The rapid replacement of phone handsets with smartphones calls the security aspects of these devices to be strengthened. Measures for prevention, detection, and reaction need to be explored with the peculiarities that resource-constrained devices impose. Smartphones, in addition to cellular broadband network capabilities, include WiFi interfaces that can even be deployed to set up a mobile ad-hoc network (MANET). While intrusion detection in MANETs is typically evaluated with network simulators, we argue that it is important to implement and test the solutions in real devices to evaluate their resource footprint. This paper presents a modular implementation of an anomaly detection and mitigation mechanism on top of a dissemination protocol for intermittentlyconnected MANETs. The overhead of the security solution is evaluated in a small testbed based on three Android-based handsets and a laptop. The study shows the feasibility of the statistics based anomaly detection regime, having low CPU usage, little added latency, and acceptable memory footprint.","Regulating deep neural networks (DNNs) with human structured knowledge has shown to be of great benefit for improved accuracy and interpretability. We develop a general framework that enables learning knowledge and its confidence jointly with the DNNs, so that the vast amount of fuzzy knowledge can be incorporated and automatically optimized with little manual efforts. We apply the framework to sentence sentiment analysis, augmenting a DNN with massive linguistic constraints on discourse and polarity structures. Our model substantially enhances the performance using less training data, and shows improved interpretability. The principled framework can also be applied to posterior regularization for regulating other statistical models."
299,15244283,28913328,A Framework for Anonymizing GSM Calls over a Smartphone VoIP Network,Secured Telemedicine Using Whole Image as Watermark with Tamper Localization and Recovery Capabilities,"Abstract. The proposed framework describes a service for users that gives them the ability to make gsm calls from their smartphones without revealing their identity. The principle to achieve that is simple: instead of using your cell phone to make a call, pick somebody else's phone to do so. We proposed an infrastructure of smartphones, sip registrars and sip proxies to provide caller anonymity. We developed a testbed where a smartphone registers on a SIP registrar and can start GSM conversation through another smartphone acting as a GSM gateway, by using a SIP proxy. Empirical evaluation revealed no significant QoS degradation.","Region of interest (ROI) is the most informative part of a medical image and mostly has been used as a major part of watermark. Various shapes ROIs selection have been reported in region-based watermarking techniques. In region-based watermarking schemes an image region of non-interest (RONI) is the second important part of the image and is used mostly for watermark encapsulation. In online healthcare systems the ROI wrong selection by missing some important portions of the image to be part of ROI can create problem at the destination. This paper discusses the complete medical image availability in original at destination using the whole image as a watermark for authentication, tamper localization and lossless recovery (WITALLOR). The WITALLOR watermarking scheme ensures the complete image security without of ROI selection at the source point as compared to the other region-based watermarking techniques. The complete image is compressed using the Lempel-Ziv-Welch (LZW) lossless compression technique to get the watermark in reduced number of bits. Bits reduction occurs to a number that can be completely encapsulated into image. The watermark is randomly encapsulated at the least significant bits (LSBs) of the image without caring of the ROI and RONI to keep the image perceptual degradation negligible. After communication, the watermark is retrieved, decompressed and used for authentication of the whole image, tamper detection, localization and lossless recovery. WITALLOR scheme is capable of any number of tampers detection and recovery at any part of the image. The complete authentic image gives the opportunity to conduct an image based analysis of medical problem without restriction to a fixed ROI."
300,1789833,11527047,Secure floating point arithmetic and private satellite collision analysis,Biocellion: accelerating computer simulation of multicellular biological system models,"In this paper, we show that it is possible and, indeed, feasible to use secure multiparty computation (SMC) for calculating the probability of a collision between two satellites. For this purpose, we first describe basic floating point arithmetic operators (addition and multiplication) for multiparty computations. The operators are implemented on the Sharemind SMC engine. We discuss the implementation details, provide methods for evaluating example elementary functions (inverse, square root, exponentiation of e, error function). Using these primitives, we implement a satellite conjunction analysis algorithm and give benchmark results for the primitives as well as the conjunction analysis itself.",ABSTRACT
301,14380011,5350123,Classification of Customer Reviews based on Sentiment Analysis,Compressed vibration modes of elastic bodies,"In this paper we propose a system that performs the classification of customer reviews of hotels by means of a sentiment analysis. We elaborate on a process to extract a domainspecific lexicon of semantically relevant words based on a given corpus (Scharl et al., 2003; Pak & Paroubek, 2010) . The resulting lexicon backs the sentiment analysis for generating a classification of the reviews. The evaluation of the classification on test data shows that the proposed system performs better compared to a predefined baseline: if a customer review is classified as good or bad the classification is correct with a probability of about 90%.","The natural vibration modes of deformable objects are a fundamental physical phenomenon. In this paper, we introduce compressed vibration modes, which, in contrast to the natural vibration modes, are localized (""sparse"") deformations. The localization is achieved by augmenting the objective which has the vibration modes as minima by a L 1 term. As a result, the compressed modes form a compromise between localization and optimal energy efficiency of the deformations. We introduce a scheme for computing bases of compressed modes by solving sequences of convex optimization problems. Our experiments demonstrate that the resulting bases are well-suited for reduced-order shape deformation and for guiding the segmentation of objects into functional parts."
302,6437213,3384525,An Optimal Overlay Topology for Routing Peer-to-Peer Searches,Third-Party Data Providers Ruin Simple Mechanisms,"Abstract. Unstructured peer-to-peer networks are frequently used as the overlay in various middleware toolkits for emerging applications, from content discovery to query result caching to distributed collaboration. Often it is assumed that unstructured networks will form a power-law topology; however, a power-law structure is not the best topology for an unstructured network. In this paper, we introduce the square-root topology, and show that this topology significantly improves routing performance compared to power-law networks. In the square-root topology, the degree of a peer is proportional to the square root of the popularity of the content at the peer. Our analysis shows that this topology is optimal for random walk searches. We also present simulation results to demonstrate that the square-root topology is better, by up to a factor of two, than a power-law topology for other types of search techniques besides random walks. We then describe a decentralized algorithm for forming a square-root topology, and evaluate its effectiveness in constructing efficient networks using both simulations and experiments with our implemented prototype. Our results show that the squareroot topology can provide a significant performance improvement over power-law topologies and other topology types.","This paper studies the revenue of simple mechanisms in settings where a third-party data provider is present. When no data provider is present, it is known that simple mechanisms achieve a constant fraction of the revenue of optimal mechanisms. The results in this paper demonstrate that this is no longer true in the presence of a third party data provider who can provide the bidder with a signal that is correlated with the item type. Specifically, we show that even with a single seller, a single bidder, and a single item of uncertain type for sale, pricing each item-type separately (the analog of item pricing for multi-item auctions) and bundling all item-types under a single price (the analog of grand bundling) can both simultaneously be a logarithmic factor worse than the optimal revenue. Further, in the presence of a data provider, item-type partitioning mechanisms-a more general class of mechanisms which divide item-types into disjoint groups and offer prices for each group-still cannot achieve within a log log factor of the optimal revenue."
303,162168699,4318805,Beyond Alternating Updates for Matrix Factorization with Inertial Bregman Proximal Gradient Algorithms,Efficient and Scalable Graph Parallel Processing With Symbolic Execution,"Matrix Factorization is a popular non-convex objective, for which alternating minimization schemes are mostly used. They usually suffer from the major drawback that the solution is biased towards one of the optimization variables. A remedy is non-alternating schemes. However, due to a lack of Lipschitz continuity of the gradient in matrix factorization problems, convergence cannot be guaranteed. A recently developed remedy relies on the concept of Bregman distances, which generalizes the standard Euclidean distance. We exploit this theory by proposing a novel Bregman distance for matrix factorization problems, which, at the same time, allows for simple/closed form update steps. Therefore, for non-alternating schemes, such as the recently introduced Bregman Proximal Gradient (BPG) method and an inertial variant Convex-Concave Inertial BPG (CoCaIn BPG), convergence of the whole sequence to a stationary point is proved for Matrix Factorization.","Existing graph processing essentially relies on the underlying iterative execution with synchronous (Sync) and/or asynchronous (Async) engine. Nevertheless, they both suffer from a wide class of inherent serialization arising from data interdependencies within a graph."
304,27023828,51895145,Modelling Evolvability in Genetic Programming,What happens-after the first race? enhancing the predictive power of happens-before based dynamic race detection,"Abstract. We develop a tree-based genetic programming system capable of modelling evolvability during evolution through machine learning algorithms, and exploiting those models to increase the efficiency and final fitness. Existing methods of determining evolvability require too much computational time to be effective in any practical sense. By being able to model evolvability instead, computational time may be reduced. This will be done first by demonstrating the effectiveness of modelling these properties a priori, before expanding the system to show its effectiveness as evolution occurs.","Dynamic race detection is the problem of determining if an observed program execution reveals the presence of a data race in a program. The classical approach to solving this problem is to detect if there is a pair of conflicting memory accesses that are unordered by Lamport's happens-before (HB) relation. HB based race detection is known to not report false positives, i.e., it is sound. However, the soundness guarantee of HB only promises that the first pair of unordered, conflicting events is a schedulable data race. That is, there can be pairs of HB-unordered conflicting data accesses that are not schedulable races because there is no reordering of the events of the execution, where the events in race can be executed immediately after each other. We introduce a new partial order, called schedulable happens-before (SHB) that exactly characterizes the pairs of schedulable data races Ð every pair of conflicting data accesses that are identified by SHB can be scheduled, and every HB-race that can be scheduled is identified by SHB. Thus, the SHB partial order is truly sound. We present a linear time, vector clock algorithm to detect schedulable races using SHB. Our experiments demonstrate the value of our algorithm for dynamic race detection Ð SHB incurs only little performance overhead and can scale to executions from real-world software applications without compromising soundness."
305,519822,201646571,An Empirical Study and Analysis of Generalized Zero-Shot Learning for Object Recognition in the Wild,Is the Red Square Big? MALeViC: Modeling Adjectives Leveraging Visual Contexts,"We investigate the problem of generalized zero-shot learning (GZSL). GZSL relaxes the unrealistic assumption in conventional ZSL that test data belong only to unseen novel classes. In GZSL, test data might also come from seen classes and the labeling space is the union of both types of classes. We show empirically that a straightforward application of the classifiers provided by existing ZSL approaches does not perform well in the setting of GZSL. Motivated by this, we propose a surprisingly simple but effective method to adapt ZSL approaches for GZSL. The main idea is to introduce a calibration factor to calibrate the classifiers for both seen and unseen classes so as to balance two conflicting forces: recognizing data from seen classes and those from unseen ones. We develop a new performance metric called the Area Under Seen-Unseen accuracy Curve to characterize this tradeoff. We demonstrate the utility of this metric by analyzing existing ZSL approaches applied to the generalized setting. Extensive empirical studies reveal strengths and weaknesses of those approaches on three well-studied benchmark datasets, including the large-scale ImageNet Full 2011 with 21,000 unseen categories. We complement our comparative studies in learning methods by further establishing an upper-bound on the performance limit of GZSL. There, our idea is to use class-representative visual features as the idealized semantic embeddings. We show that there is a large gap between the performance of existing approaches and the performance limit, suggesting that improving the quality of class semantic embeddings is vital to improving zero-shot learning.","This work aims at modeling how the meaning of gradable adjectives of size ('big', 'small') can be learned from visually-grounded contexts. Inspired by cognitive and linguistic evidence showing that the use of these expressions relies on setting a threshold that is dependent on a specific context, we investigate the ability of multi-modal models in assessing whether an object is 'big' or 'small' in a given visual scene. In contrast with the standard computational approach that simplistically treats gradable adjectives as 'fixed' attributes, we pose the problem as relational: to be successful, a model has to consider the full visual context. By means of four main tasks, we show that state-of-the-art models (but not a relatively strong baseline) can learn the function subtending the meaning of size adjectives, though their performance is found to decrease while moving from simple to more complex tasks. Crucially, models fail in developing abstract representations of gradable adjectives that can be used compositionally."
