,paper1_id,paper2_id,title1,title2,abstract1,abstract2
92,1432862,208910346,On Optimising Route Discovery in Absence of Previous Route Information in MANETs,SampleNet: Differentiable Point Cloud Sampling,Abstract,"There is a growing number of tasks that work directly on point clouds. As the size of the point cloud grows, so do the computational demands of these tasks. A possible solution is to sample the point cloud first. Classic sampling approaches, such as farthest point sampling (FPS), do not consider the downstream task. A recent work showed that learning a task-specific sampling can improve results significantly. However, the proposed technique did not deal with the non-differentiability of the sampling operation and offered a workaround instead."
93,2845094,199006723,Interactive tracking of insect posture,An Autonomous Wireless Health Monitoring System Based on Heartbeat and Accelerometer Sensors,Multiple object tracking Active key frame selection Interactive user correction and tracks refinement Insect tracking a b s t r a c t,"Abstract: Falls are a main cause of injury for patients with certain diseases. Patients who wear health monitoring systems can go about daily activities without limitations, thereby enhancing their quality of life. In this paper, patient falls and heart rate were accurately detected and measured using two proposed algorithms. The first algorithm, abnormal heart rate detection (AHRD), improves patient heart rate measurement accuracy and distinguishes between normal and abnormal heart rate functions. The second algorithm, TB-AIC, combines an acceleration threshold and monitoring of patient activity/inactivity functions to accurately detect patient falls. The two algorithms were practically implemented in a proposed autonomous wireless health monitoring system (AWHMS). The AWHMS was implemented based on a GSM module, GPS, microcontroller, heartbeat and accelerometer sensors, and a smartphone. The measurement accuracy of the recorded heart rate was evaluated based on the mean absolute error, Bland-Altman plots, and correlation coefficients. Fourteen types of patient activities were considered (seven types of falling and seven types of daily activities) to determine the fall detection accuracy. The results indicate that the proposed AWHMS succeeded in monitoring the patient's vital signs, with heart rate measurement and fall detection accuracies of 98.75% and 99.11%, respectively. In addition, the sensitivity and specificity of the fall detection algorithm (both 99.12%) were explored."
94,18506295,184486899,Gateless Treasure: How to Get Sensitive Information from Unprotected External Storage on Android Phones,Modeling the Past and Future Contexts for Session-based Recommendation.,"The flexibility of Android is mainly based on the cross application (app for short) access mechanism. Aside from providing convenience for both app developers and users, such a mechanism also brings the data in external storage which originally regarded harmless into serious privacy breaches. In this paper, we studied various popular apps and developed three different attacks leveraging the public information freely available to zero-permission apps. The first attack can smuggle out the sensitive data which reveals the victim's profile information directly, such as real name, phone number, email address, social networking accounts, etc. With the help of image comparing techniques and current social networking services, we can find out the owners of the phone numbers acquired from a victim's WhatsApp with a high probability. Moreover, the location of the victim is also not spared in the disaster. Comparing to the previous location inferring attacks, our approach is more general since the victim's identity is also acquired by our attack. These three attacks reveal the privacy risks of external storage are much more serious than people previously thought and need to be addressed urgently. In fact, all these threats are caused by the file system used by external storage which calls into question the reasonability of the assumptions on the cross app access mechanism. To the end, we propose a preliminary mitigation approach to achieve a delicate balance between utility and privacy of the data stored in external storage.","Long session-based recommender systems have attacted much attention recently. For each user, they may create hundreds of click behaviors in short time. To learn long session item dependencies, previous sequential recommendation models resort either to data augmentation or a left-to-right autoregressive training approach. While effective, an obvious drawback is that future user behaviors are always mising during training. In this paper, we claim that users' future action signals can be exploited to boost the recommendation quality. To model both past and future contexts, we investigate three ways of augmentation techniques from both data and model perspectives. Moreover, we carefully design two general neural network architectures: a pretrained two-way neural network model and a deep contextualized model trained on a text gap-filling task. Experiments on four real-word datasets show that our proposed two-way neural network models can achieve competitive or even much better results. Empirical evidence confirms that modeling both past and future context is a promising way to offer better recommendation accuracy."
95,5844893,118686970,Human Pose Co-Estimation and Applications,Temporal Cycle-Consistency Learning,"Abstract-Most existing techniques for articulated Human Pose Estimation (HPE) consider each person independently. Here we tackle the problem in a new setting, coined Human Pose Coestimation (PCE), where multiple people are in a common, but unknown pose. The task of PCE is to estimate their poses jointly and to produce prototypes characterizing the shared pose. Since the poses of the individual people should be similar to the prototype, PCE has less freedom compared to estimating each pose independently, which simplifies the problem. We demonstrate our PCE technique on two applications. The first is estimating the pose of people performing the same activity synchronously, such as during aerobics, cheerleading, and dancing in a group. We show that PCE improves pose estimation accuracy over estimating each person independently. The second application is learning prototype poses characterizing a pose class directly from an image search engine queried by the class name (e.g., ""lotus pose""). We show that PCE leads to better pose estimation in such images, and it learns meaningful prototypes which can be used as priors for pose estimation in novel images.","We present a self-supervised representation learning technique called temporal cycle consistency (TCC) learning. It is inspired by the temporal video alignment problem, which refers to the task of finding correspondences across multiple videos despite many factors of variation. The learned representations are useful for fine-grained temporal understanding in videos. Additionally, we can now align multiple videos by simply finding nearest-neighbor frames in the embedding space."
96,199442413,53078037,GDRQ: Group-based Distribution Reshaping for Quantization,Motion Perception in Reinforcement Learning with Dynamic Objects,"Low-bit quantization is challenging to maintain high performance with limited model capacity (e.g., 4-bit for both weights and activations). Naturally, the distribution of both weights and activations in deep neural network are Gaussian-like. Nevertheless, due to the limited bitwidth of low-bit model, uniform-like distributed weights and activations have been proved to be more friendly to quantization while preserving accuracy [11] . Motivated by this, we propose Scale-Clip, a Distribution Reshaping technique that can reshape weights or activations into a uniform-like distribution in a dynamic manner. Furthermore, to increase the model capability for a low-bit model, a novel Groupbased Quantization algorithm is proposed to split the filters into several groups. Different groups can learn different quantization parameters, which can be elegantly merged in to batch normalization layer without extra computational cost in the inference stage. Finally, we integrate Scale-Clip technique with Group-based Quantization algorithm and propose the Group-based Distribution Reshaping Quantization (GDQR) framework to further improve the quantization performance. Experiments on various networks (e.g. VGGNet and ResNet) and vision tasks (e.g. classification, detection and segmentation) demonstrate that our framework achieves much better performance than stateof-the-art quantization methods. Specifically, the ResNet-50 model with 2-bit weights and 4-bit activations obtained by our framework achieves less than 1% accuracy drop on ImageNet classification task, which is a new state-of-theart to our best knowledge.","Abstract: In dynamic environments, learned controllers are supposed to take motion into account when selecting the action to be taken. However, in existing reinforcement learning works motion is rarely treated explicitly; it is rather assumed that the controller learns the necessary motion representation from temporal stacks of frames implicitly. In this paper, we show that for continuous control tasks learning an explicit representation of motion improves the quality of the learned controller in dynamic scenarios. We demonstrate this on common benchmark tasks (Walker, Swimmer, Hopper), on target reaching and ball catching tasks with simulated robotic arms, and on a dynamic single ball juggling task. Moreover, we find that when equipped with an appropriate network architecture, the agent can, on some tasks, learn motion features also with pure reinforcement learning, without additional supervision. Further we find that using an image difference between the current and the previous frame as an additional input leads to better results than a temporal stack of frames. "
97,212725037,7387967,A model of figure ground organization incorporating local and global cues,Understanding the Spatial Characteristics of DRAM Errors in HPC Clusters,"Organization (FGO) -inferring spatial depth ordering of objects in a visual scene -involves determining which side of an occlusion boundary is figure (closer to the observer) and which is ground (further away from the observer). A combination of global cues, like convexity, and local cues, like T-junctions are involved in this process. We present a biologically motivated, feed forward computational model of FGO incorporating convexity, surroundedness, parallelism as global cues and spectral anisotropy (SA), Tjunctions as local cues. While SA is computed in a biologically plausible manner, the inclusion of T-Junctions is biologically motivated. The model consists of three independent feature channels, Color, Intensity and Orientation, but SA and T-Junctions are introduced only in the Orientation channel as these properties are specific to that feature of objects. We study the effect of adding each local cue independently and both of them simultaneously to the model with no local cues. We evaluate model performance based on figure-ground classification accuracy (FGCA) at every border location using the BSDS 300 figure-ground dataset. Each local cue, when added alone, gives statistically significant improvement in the FGCA of the model suggesting its usefulness as an independent FGO cue. The model with both local cues achieves higher FGCA than the models with individual cues, indicating SA and T-Junctions are not mutually contradictory. Compared to the model with no local cues, the feed-forward model with both local cues achieves ≥ 8.78% improvement in terms of FGCA.","Understanding DRAM errors in high-performance computing (HPC) clusters is paramount to address future HPC resilience challenges. While there have been studies on this topic, previous work has focused on on-node and single-rack characteristics of errors; conversely, few studies have presented insights into the spatial behavior of DRAM errors across an entire cluster. Understanding spatial peculiarities of DRAM errors through an entire cluster is crucial for cluster temperature management, job allocation, and failure prediction. In this paper, we study the spatial nature of DRAM errors on data gathered in a large production HPC cluster. Our analysis shows that nodes with high degree of errors are grouped in spatial regions for time periods, suggesting that these ""susceptible"" regions are collectively more vulnerable to errors than other regions. We then use our observations to build a predictor, which identifies such regions given prior neighboring regions patterns."
98,52903891,55295552,Optimal Pricing For MHR Distributions,SEGMENTATION OF ENVIRONMENTAL TIME LAPSE IMAGE SEQUENCES FOR THE DETERMINATION OF SHORE LINES CAPTURED BY HAND-HELD SMARTPHONE CAMERAS,"We study the performance of anonymous posted-price selling mechanisms for a standard Bayesian auction setting, where n bidders have i.i.d. valuations for a single item. We show that for the natural class of Monotone Hazard Rate (MHR) distributions, offering the same, take-it-or-leave-it price to all bidders can achieve an (asymptotically) optimal revenue. In particular, the approximation ratio is shown to be 1 + O(ln ln n/ ln n), matched by a tight lower bound for the case of exponential distributions. This improves upon the previously best-known upper bound of e/(e − 1) ≈ 1.58 for the slightly more general class of regular distributions. In the worst case (over n), we still show a global upper bound of 1.35. We give a simple, closed-form description of our prices which, interestingly enough, relies only on minimal knowledge of the prior distribution, namely just the expectation of its secondhighest order statistic.","The relevance of globally environmental issues gains importance since the last years with still rising trends. Especially disastrous floods may cause in serious damage within very short times. Although conventional gauging stations provide reliable information about prevailing water levels, they are highly cost-intensive and thus just sparsely installed. Smartphones with inbuilt cameras, powerful processing units and low-cost positioning systems seem to be very suitable wide-spread measurement devices that could be used for geo-crowdsourcing purposes. Thus, we aim for the development of a versatile mobile water level measurement system to establish a densified hydrological network of water levels with high spatial and temporal resolution. This paper addresses a key issue of the entire system: the detection of running water shore lines in smartphone images. Flowing water never appears equally in closerange images even if the extrinsics remain unchanged. Its non-rigid behavior impedes the use of good practices for image segmentation as a prerequisite for water line detection. Consequently, we use a hand-held time lapse image sequence instead of a single image that provides the time component to determine a spatio-temporal texture image. Using a region growing concept, the texture is analyzed for immutable shore and dynamic water areas. Finally, the prevalent shore line is examined by the resultant shapes. For method validation, various study areas are observed from several distances covering urban and rural flowing waters with different characteristics. Future work provides a transformation of the water line into object space by image-to-geometry intersection."
99,198179916,1177533,Efficient Knowledge Graph Accuracy Evaluation,Flux: FunctionaL Updates for XML (extended report),"Estimation of the accuracy of a large-scale knowledge graph (KG) often requires humans to annotate samples from the graph. How to obtain statistically meaningful estimates for accuracy evaluation while keeping human annotation costs low is a problem critical to the development cycle of a KG and its practical applications. Surprisingly, this challenging problem has largely been ignored in prior research. To address the problem, this paper proposes an efficient sampling and evaluation framework, which aims to provide quality accuracy evaluation with strong statistical guarantee while minimizing human efforts. Motivated by the properties of the annotation cost function observed in practice, we propose the use of cluster sampling to reduce the overall cost. We further apply weighted and two-stage sampling as well as stratification for better sampling designs. We also extend our framework to enable efficient incremental evaluation on evolving KG, introducing two solutions based on stratified sampling and a weighted variant of reservoir sampling. Extensive experiments on real-world datasets demonstrate the effectiveness and efficiency of our proposed solution. Compared to baseline approaches, our best solutions can provide up to 60% cost reduction on static KG evaluation and up to 80% cost reduction on evolving KG evaluation, without loss of evaluation quality. PVLDB Reference Format:","XML database query languages have been studied extensively, but XML database updates have received relatively little attention, and pose many challenges to language design. We are developing an XML update language called FLUX, which stands for FunctionaL Updates for XML, drawing upon ideas from functional programming languages. In prior work, we have introduced a core language for FLUX with a clear operational semantics and a sound, decidable static type system based on regular expression types."
100,1867589,192641055,Valid Signature Detection and Verification for Security of Individual Person,Hashing Graph Convolution for Node Classification,"In the recent research work, the handwritten signature is a suitable field to detection of valid signature from different environment such online signature and offline signature. In early research work, a lot of unauthorized person put the signature and theft the data in illegal manner from organization or industries. So we have to need identify, the right person on the basis of various parameters that can be detected. In this paper, we have proposed two methods namely LDA and Neural Network for the offline signature from the scan signature image. For efficient research, we have focused the comparative analysis in terms of FRR, SSIM, MSE, and PSNR. These parameters are compared with the early work and the recent work. Our proposed work is more effective and provides the suitable result through our method which leads to existing work. Our method will help to find legal signature of authorized use for security and avoid illegal work.","Convolution on graphs has aroused great interest in AI due to its potential applications to non-gridded data. To bypass the influence of ordering and different node degrees, the summation/average diffusion/aggregation is often imposed on local receptive field in most prior works. However, the collapsing into one node in this way tends to cause signal entanglements of nodes, which would result in a sub-optimal feature and decrease the discriminability of nodes. To address this problem, in this paper, we propose a simple but effective Hashing Graph Convolution (HGC) method by using global-hashing and local-projection on node aggregation for the task of node classification. In contrast to the conventional aggregation with a full collision, the hash-projection can greatly reduce the collision probability during gathering neighbor nodes. Another incidental effect of hash-projection is that the receptive field of each node is normalized into a common-size bucket space, which not only staves off the trouble of different-size neighbors and their order but also makes a graph convolution run like the standard shape-gridded convolution. Considering the few training samples, also, we introduce a prediction-consistent regularization term into HGC to constrain the score consistency of unlabeled nodes in the graph. HGC is evaluated on both transductive and inductive experimental settings and achieves new state-of-the-art results on all datasets for node classification task. The extensive experiments demonstrate the effectiveness of hash-projection."
101,52126647,3630117,Deep-BGT at PARSEME Shared Task 2018: Bidirectional LSTM-CRF Model for Verbal Multiword Expression Identification,Do Citations and Readership Identify Seminal Publications?,"This paper describes the Deep-BGT system that participated to the PARSEME shared task 2018 on automatic identification of verbal multiword expressions (VMWEs). Our system is languageindependent and uses the bidirectional Long Short-Term Memory model with a Conditional Random Field layer on top (bidirectional LSTM-CRF). To the best of our knowledge, this paper is the first one that employs the bidirectional LSTM-CRF model for VMWE identification. Furthermore, the gappy 1-level tagging scheme is used for discontiguity and overlaps. Our system was evaluated on 10 languages in the open track and it was ranked the second in terms of the general ranking metric.","Abstract In this paper, we show that citation counts work better than a random baseline (by a margin of 10%) in distinguishing excellent research, while Mendeley reader counts don't work better than the baseline. Specifically, we study the potential of these metrics for distinguishing publications that caused a change in a research field from those that have not. The experiment has been conducted on a new dataset for bibliometric research called TrueImpactDataset. TrueImpactDataset is a collection of research publications of two types -research papers which are considered seminal works in their area and papers which provide a literature review of a research area. We provide overview statistics of the dataset and propose to use it for validating research evaluation metrics. Using the dataset, we conduct a set of experiments to study how citation and reader counts perform in distinguishing these publication types, following the intuition that causing a change in a field signifies research contribution. We show that citation counts help in distinguishing research that strongly influenced later developments from works that predominantly discuss the current state of the art with a degree of accuracy (63%, i.e. 10% over the random baseline). In all setups, Mendeley reader counts perform worse than a random baseline."
102,88482858,7766082,Adaptive Makeup Transfer via Bat Algorithm,VERT: a semantic approach for content search and content extraction in XML query processing,"With the advent of the artificial intelligence (AI) era, the beauty camera is widely used, and makeup transfer has attracted increasing attention. In this paper, we propose an adaptive makeup transfer based on the bat algorithm to solve the problem that only a single makeup effect can be transferred. According to the characteristics of makeup style, the algorithm optimizes the weight value to get the appropriate makeup lightness by using the adaptive method. The improved algorithm can not only help to get the optimal weight values in the process of transferring the same makeup style to different targets, but also to transfer different makeup styles to the same target. Moreover, this algorithm can choose the most suitable makeup style and also the most appropriate lightness for a certain person. Experimental results show that the algorithm proposed in the paper has a better effect than the existing algorithm of makeup transfer, and the algorithm can provide users with a suitable makeup style and appropriate lightness.","Abstract. Processing a twig pattern query in XML document includes structural search and content search. Most existing algorithms only focus on structural search. They treat content nodes the same as element nodes during query processing with structural joins. Due to the high variety of contents, to mix content search and structural search suffers from management problem of contents and low performance. Another disadvantage is to find the actual values asked by a query, they have to rely on the original document. In this paper, we propose a novel algorithm V alue Extraction with Relational T able (V ERT ) to overcome these limitations. The main technique of V ERT is introducing relational tables to store document contents instead of treating them as nodes and labeling them. Tables in our algorithm are created based on semantic information of documents. As more semantics is captured, we can further optimize tables and queries to significantly enhance efficiency. Last, we show by experiments that besides solving different content problems, V ERT also has superiority in performance of twig pattern query processing compared with existing algorithms."
