,paper1_id,paper2_id,title1,title2,abstract1,abstract2
183,204938490,212725694,Ensemble representation learning: an analysis of fitness and survival for wrapper-based genetic programming methods,"TailorNet: Predicting Clothing in 3D as a Function of Human Pose, Shape and Garment Style","Recently we proposed a general, ensemble-based feature engineering wrapper (FEW) that was paired with a number of machine learning methods to solve regression problems. Here, we adapt FEW for supervised classi cation and perform a thorough analysis of tness and survival methods within this framework. Our tests demonstrate that two tness metrics, one introduced as an adaptation of the silhoue e score, outperform the more commonly used Fisher criterion. We analyze survival methods and demonstrate that ϵ-lexicase survival works best across our test problems, followed by random survival which outperforms both tournament and deterministic crowding. We conduct a benchmark comparison to several classi cation methods using a large set of problems and show that FEW can improve the best classi er performance in several cases. We show that FEW generates consistent, meaningful features for a biomedical problem with di erent ML pairings. ",": We present TailorNet, a model to estimate the clothing deformations with fine details from input body shape, body pose and garment style. From the left: the first two avatars show two different styles on the same shape, the following two show the same two styles on another shape, and the last two avatars illustrate that our method works for different garments."
184,15720335,27940615,Static Ranking of Scholarly Papers using Article-Level Eigenfactor (ALEF),Synthetic Workload Generation of Broadcast Related HEVC Stream Decoding for Resource Constrained Systems,"Microsoft Research hosted the 2016 WSDM Cup Challenge based on the Microsoft Academic Graph. The goal was to provide static rankings for the articles that make up the graph, with the rankings to be evaluated against those of human judges. While the Microsoft Academic Graph provided metadata about many aspects of each scholarly document, we focused more narrowly on citation data and used this contest as an opportunity to test the Article Level Eigenfactor (ALEF), a novel citation-based ranking algorithm, and evaluate its performance against competing algorithms that drew upon multiple facets of the data from a large, real world dataset (122M papers and 757M citations). Our final submission to this contest was scored at 0.676, earning second place.","Performance evaluation of platform resource management protocols, require realistic workload models as input to obtain reliable, accurate results. This is particularly important for workloads with large variations, such as video streams generated by advanced encoders using complex coding tools. In the modern High Efficiency Video Coding (HEVC) standard, a frame is logically subdivided into rectangular coding units. This work presents synthetic HEVC decoding workload generation algorithms classified at the frame and coding unit levels, where a group of pictures is considered as a directed acyclic graph based taskset. Video streams are encoded using a minimum number of reference frames, compatible with low-memory decoders. Characteristic data from several HEVC video streams, is extracted to analyse inter-frame dependency patterns, reference data volume, frame/coding unit decoding times and other coding unit properties. Histograms are used to analyse their statistical characteristics and to fit to known theoretical probability density functions. Statistical properties of the analysed video streams are integrated into two novel algorithms, that can be used to synthetically generate HEVC decoding workloads, with realistic dependency patterns and frame-level properties."
185,208915826,52154114,Barnes-Hut-SNE,Patch Correspondences for Interpreting Pixel-level CNNs,"The paper presents an O(N log N )-implementation of t-SNE -an embedding technique that is commonly used for the visualization of high-dimensional data in scatter plots and that normally runs in O(N 2 ). The new implementation uses vantage-point trees to compute sparse pairwise similarities between the input data objects, and it uses a variant of the Barnes-Hut algorithm to approximate the forces between the corresponding points in the embedding. Our experiments show that the new algorithm, called Barnes-Hut-SNE, leads to substantial computational advantages over standard t-SNE, and that it makes it possible to learn embeddings of data sets with millions of objects.","We present compositional nearest neighbors (CompNN), a simple approach to visually interpreting distributed representations learned by a convolutional neural network (CNN) for pixel-level tasks (e.g., image synthesis and segmentation). It does so by reconstructing both a CNN's input and output image by copy-pasting corresponding patches from the training set with similar feature embeddings. To do so efficiently, it makes of a patch-match-based algorithm that exploits the fact that the patch representations learned by a CNN for pixel level tasks vary smoothly. Finally, we show that CompNN can be used to establish semantic correspondences between two images and control properties of the output image by modifying the images contained in the training set. We present qualitative and quantitative experiments for semantic segmentation and image-to-image translation that demonstrate that CompNN is a good tool for interpreting the embeddings learned by pixel-level CNNs."
186,12224819,2966198,Stochastic invariants for probabilistic termination,PIRKER ET AL.: HISTOGRAM OF ORIENTED CAMERAS 1 Histogram of Oriented Cameras- A New Descriptor for Visual SLAM in Dynamic Environments,"Termination is one of the basic liveness properties, and we study the termination problem for probabilistic programs with real-valued variables. Previous works focused on the qualitative problem that asks whether an input program terminates with probability 1 (almost-sure termination). A powerful approach for this qualitative problem is the notion of ranking supermartingales with respect to a given set of invariants. The quantitative problem (probabilistic termination) asks for bounds on the termination probability, and this problem has not been addressed yet. A fundamental and conceptual drawback of the existing approaches to address probabilistic termination is that even though the supermartingales consider the probabilistic behaviour of the programs, the invariants are obtained completely ignoring the probabilistic aspect (i.e., the invariants are obtained considering all behaviours with no information about the probability).","Simultaneous localization and mapping (SLAM) is a basic prerequisite in autonomous mobile robotics. Most existing visual SLAM approaches either assume a static environment, or simply 'forget' old parts of the map to cope with map size constraints and scene dynamics. We present a novel map representation for sparse visual features. A new 3D point descriptor called Histogram of Oriented Cameras (HOC) encodes anisotropic spatial visibility information and the importance of each three-dimensional landmark. Each feature holds and updates a histogram of the poses of observing cameras. It is hereby able to estimate its probability of occlusion and importance for localization from a given viewpoint. In a series of simulated and real-world experiments we prove that the proposed descriptor allows to cope with dynamic changes in the map, improves localization accuracy and enables reasonable control of the map size."
187,211259464,212665306,Discriminative Particle Filter Reinforcement Learning for Complex Partial Observations,Toward Flexible and Efficient Home Context Sensing: Capability Evaluation and Verification of Image-Based Cognitive APIs †,"Deep reinforcement learning is successful in decision making for sophisticated games, such as Atari, Go, etc. However, real-world decision making often requires reasoning with partial information extracted from complex visual observations. This paper presents Discriminative Particle Filter Reinforcement Learning (DPFRL), a new reinforcement learning framework for complex partial observations. DPFRL encodes a differentiable particle filter in the neural network policy for explicit reasoning with partial observations over time. The particle filter maintains a belief using learned discriminative update, which is trained end-to-end for decision making. We show that using the discriminative update instead of standard generative models results in significantly improved performance, especially for tasks with complex visual observations, because they circumvent the difficulty of modeling complex observations that are irrelevant to decision making. In addition, to extract features from the particle belief, we propose a new type of belief feature based on the moment generating function. DPFRL outperforms state-of-the-art POMDP RL models in Flickering Atari Games, an existing POMDP RL benchmark, and in Natural Flickering Atari Games, a new, more challenging POMDP RL benchmark introduced in this paper. Further, DPFRL performs well for visual navigation with real-world data in the Habitat environment. The code is available online 1 .","Cognitive Application Program Interface (API) is an API of emerging artificial intelligence (AI)-based cloud services, which extracts various contextual information from non-numerical multimedia data including image and audio. Our interest is to apply image-based cognitive APIs to implement flexible and efficient context sensing services in a smart home. In the existing approach with machine learning by us, with the complexity of recognition object and the number of the defined contexts increases by users, it still requires directly manually labeling a moderate scale of data for training and continually try to calling multiple cognitive APIs for feature extraction. In this paper, we propose a novel method that uses a small scale of labeled data to evaluate the capability of cognitive APIs in advance, before training features of the APIs with machine learning, for the flexible and efficient home context sensing. In the proposed method, we exploit document similarity measures and the concepts (i.e., internal cohesion and external isolation) integrate into clustering results, to see how the capability of different cognitive APIs for recognizing each context. By selecting the cognitive APIs that relatively adapt to the defined contexts and data based on the evaluation results, we have achieved the flexible integration and efficient process of cognitive APIs for home context sensing."
188,10717029,9647408,Ranking with Diverse Intents and Correlated Contents,Towards statistically strong source anonymity for sensor networks,"We consider the following document ranking problem: We have a collection of documents, each containing some topics (e.g. sports, politics, economics). We also have a set of users with diverse interests. Assume that user u is interested in a subset I u of topics. Each user u is also associated with a positive integer K u , which indicates that u can be satisfied by any K u topics in I u . Each document s contains information for a subset C s of topics. The objective is to pick one document at a time such that the average satisfying time is minimized, where a user's satisfying time is the first time that at least K u topics in I u are covered in the documents selected so far.","For sensor networks deployed to monitor and report real events, event source anonymity is an attractive and critical security property, which unfortunately is also very difficult and expensive to achieve. This is not only because adversaries may attack against sensor source privacy through traffic analysis, but also because sensor networks are very limited in resources. As such, a practical trade-off between security and performance is desirable. In this article, for the first time we propose the notion of statistically strong source anonymity, under a challenging attack model where a global attacker is able to monitor the traffic in the entire network. We propose a scheme called FitProbRate, which realizes statistically strong source anonymity for sensor networks. We demonstrate the robustness of our scheme under various statistical tests that might be employed by the attacker to detect real events. Our analysis and simulation results show that our scheme, besides providing source anonymity, can significantly reduce real event reporting latency compared to two baseline schemes."
189,4318805,15323609,Efficient and Scalable Graph Parallel Processing With Symbolic Execution,An Example for BeSpaceD and its Use for Decision Support in Industrial Automation,"Existing graph processing essentially relies on the underlying iterative execution with synchronous (Sync) and/or asynchronous (Async) engine. Nevertheless, they both suffer from a wide class of inherent serialization arising from data interdependencies within a graph.","We describe our formal methods-based spatial reasoning framework BeSpaceD and its application in decision support for industrial automation. In particular we are supporting analysis and decisions based on formal models for industrial plant and mining operations. BeSpaceD is a framework for deciding geometric and topological properties of spatio-temporal models. We present an example and report on our ongoing experience with applications in different projects around software and cyber-physical systems engineering. The example features abstracted aspects of a production plant model. Using the example we motivate the use of our framework in the context of an existing software platform supporting monitoring, incident handling and maintenance of industrial automation facilities in remote locations."
190,17678759,7627310,Can Ground Truth Label Propagation from Video help Semantic Segmentation?,Digital Stylometry: Linking Profiles Across Social Networks,"Abstract. For state-of-the-art semantic segmentation task, training convolutional neural networks (CNNs) requires dense pixelwise ground truth (GT) labeling, which is expensive and involves extensive human effort. In this work, we study the possibility of using auxiliary ground truth, so-called pseudo ground truth (PGT) to improve the performance. The PGT is obtained by propagating the labels of a GT frame to its subsequent frames in the video using a simple CRF-based, cue integration framework. Our main contribution is to demonstrate the use of noisy PGT along with GT to improve the performance of a CNN. We perform a systematic analysis to find the right kind of PGT that needs to be added along with the GT for training a CNN. In this regard, we explore three aspects of PGT which influence the learning of a CNN: i) the PGT labeling has to be of good quality; ii) the PGT images have to be different compared to the GT images; iii) the PGT has to be trusted differently than GT. We conclude that PGT which is diverse from GT images and has good quality of labeling can indeed help improve the performance of a CNN. Also, when PGT is multiple folds larger than GT, weighing down the trust on PGT helps in improving the accuracy. Finally, We show that using PGT along with GT, the performance of Fully Convolutional Network (FCN) on Camvid data is increased by 2.7% on IoU accuracy. We believe such an approach can be used to train CNNs for semantic video segmentation where sequentially labeled image frames are needed. To this end, we provide recommendations for using PGT strategically for semantic segmentation and hence bypass the need for extensive human efforts in labeling.","Abstract. There is an ever growing number of users with accounts on multiple social media and networking sites. Consequently, there is increasing interest in matching user accounts and profiles across different social networks in order to create aggregate profiles of users. In this paper, we present models for Digital Stylometry, which is a method for matching users through stylometry inspired techniques. We experimented with linguistic, temporal, and combined temporal-linguistic models for matching user accounts, using standard and novel techniques. Using publicly available data, our best model, a combined temporal-linguistic one, was able to correctly match the accounts of 31% of 5, 612 distinct users across Twitter and Facebook."
191,204962615,29170388,PPR-SSM: personalized PageRank and semantic similarity measures for entity linking,Approximate Bayesian inference in spatial environments,"Background: Biomedical literature concerns a wide range of concepts, requiring controlled vocabularies to maintain a consistent terminology across different research groups. However, as new concepts are introduced, biomedical literature is prone to ambiguity, specifically in fields that are advancing more rapidly, for example, drug design and development. Entity linking is a text mining task that aims at linking entities mentioned in the literature to concepts in a knowledge base. For example, entity linking can help finding all documents that mention the same concept and improve relation extraction methods. Existing approaches focus on the local similarity of each entity and the global coherence of all entities in a document, but do not take into account the semantics of the domain. Results: We propose a method, PPR-SSM, to link entities found in documents to concepts from domain-specific ontologies. Our method is based on Personalized PageRank (PPR), using the relations of the ontology to generate a graph of candidate concepts for the mentioned entities. We demonstrate how the knowledge encoded in a domain-specific ontology can be used to calculate the coherence of a set of candidate concepts, improving the accuracy of entity linking. Furthermore, we explore weighting the edges between candidate concepts using semantic similarity measures (SSM). We show how PPR-SSM can be used to effectively link named entities to biomedical ontologies, namely chemical compounds, phenotypes, and gene-product localization and processes.","We propose to learn a stochastic recurrent model to solve the problem of simultaneous localisation and mapping (SLAM). Our model is a deep variational Bayes filter augmented with a latent global variable---similar to an external memory component---representing the spatially structured environment. Reasoning about the pose of an agent and the map of the environment is then naturally expressed as posterior inference in the resulting generative model. We evaluate the method on a set of randomly generated mazes which are traversed by an agent equipped with laser range finders. Path integration based on an accurate motion model is consistently outperformed, and most importantly, drift practically eliminated. Our approach inherits favourable properties from neural networks, such as differentiability, flexibility and the ability to train components either in isolation or end-to-end."
192,52926391,3933812,Security from the Adversary’s Inertia–Controlling Convergence Speed When Playing Mixed Strategy Equilibria,Structure and Properties of Traces for Functional Programs,"Game-theoretic models are a convenient tool to systematically analyze competitive situations. This makes them particularly handy in the field of security where a company or a critical infrastructure wants to defend against an attacker. When the optimal solution of the security game involves several pure strategies (i.e., the equilibrium is mixed), this may induce additional costs. Minimizing these costs can be done simultaneously with the original goal of minimizing the damage due to the attack. Existing models assume that the attacker instantly knows the action chosen by the defender (i.e., the pure strategy he is playing in the i-th round) but in real situations this may take some time. Such adversarial inertia can be exploited to gain security and save cost. To this end, we introduce the concept of information delay, which is defined as the time it takes an attacker to mount an attack. In this period it is assumed that the adversary has no information about the present state of the system, but only knows the last state before commencing the attack. Based on a Markov chain model we construct strategy policies that are cheaper in terms of maintenance (switching costs) when compared to classical approaches. The proposed approach yields slightly larger security risk but overall ensures a better performance. Furthermore, by reinvesting the saved costs in additional security measures it is possible to obtain even more security at the same overall cost.","The tracer Hat records in a detailed trace the computation of a program written in the lazy functional language Haskell. The trace can then be viewed in various ways to support program comprehension and debugging. The trace was named the augmented redex trail. Its structure was inspired by standard graph rewriting implementations of functional languages. Here we describe a model of the trace that captures its essential properties and allows formal reasoning. The trace is a graph constructed by graph rewriting but goes beyond simple term graphs. Although the trace is a graph whose structure is independent of any rewriting strategy, we define the trace inductively, thus giving us a powerful method for proving its properties."
193,210919923,22448205,BasConv: Aggregating Heterogeneous Interactions for Basket Recommendation with Graph Convolutional Neural Network,Towards a Theory of Data-Diff: Optimal Synthesis of Succinct Data Modification Scripts,"Within-basket recommendation reduces the exploration time of users, where the user's intention of the basket matters. The intent of a shopping basket can be retrieved from both user-item collaborative filtering signals and multi-item correlations. By defining a basket entity to represent the basket intent, we can model this problem as a basket-item link prediction task in the User-Basket-Item (UBI) graph. Previous work solves the problem by leveraging user-item interactions and item-item interactions simultaneously. However, collectivity and heterogeneity characteristics are hardly investigated before. Collectivity defines the semantics of each node which should be aggregated from both directly and indirectly connected neighbors. Heterogeneity comes from multi-type interactions as well as multi-type nodes in the UBI graph. To this end, we propose a new framework named BasConv, which is based on the graph convolutional neural network. Our BasConv model has three types of aggregators specifically designed for three types of nodes. They collectively learn node embeddings from both neighborhood and high-order context. Additionally, the interactive layers in the aggregators can distinguish different types of interactions. Extensive experiments on two real-world datasets prove the effectiveness of BasConv. * work is done during internship at Walmart Labs","This paper addresses the DATA-DIFF problem: given a dataset and a subsequent version of the dataset, find the shortest sequence of operations that transforms the dataset to the subsequent version, under a restricted family of operations. We consider operations similar to SQL UPDATE, each with a condition (WHERE) that matches a subset of tuples and a modifier (SET) that makes changes to those matched tuples. We characterize the problem based on different constraints on the attributes and the allowed conditions and modifiers, providing complexity classification and algorithms in each case."
194,147704094,17728778,Rumour Detection Via News Propagation Dynamics and User Representation Learning,Deep Markov Neural Network for Sequential Data Classification,"Rumours have existed for a long time and have been known for serious consequences. The rapid growth of social media platforms has multiplied the negative impact of rumours; it thus becomes important to early detect them. Many methods have been introduced to detect rumours using the content or the social context of news. However, most existing methods ignore or do not explore effectively the propagation pattern of news in social media, including the sequence of interactions of social media users with news across time. In this work, we propose a novel method for rumour detection based on deep learning. Our method leverages the propagation process of the news by learning the users' representation and the temporal interrelation of users' responses. Experiments conducted on Twitter and Weibo datasets demonstrate the state-of-the-art performance of the proposed method. * The work was done when Xiao Luo was a student at Vrije Universiteit Brussel, Belgium",We present a general framework for incorporating sequential data and arbitrary features into language modeling. The general framework consists of two parts: a hidden Markov component and a recursive neural network component. We demonstrate the effectiveness of our model by applying it to a specific application: predicting topics and sentiments in dialogues. Experiments on real data demonstrate that our method is substantially more accurate than previous methods.
